{
    "keyword": "expat health insurance",
    "country": "US",
    "language": "en",
    "competitors": [
        {
            "position": 2,
            "domain": "www.imglobal.com",
            "title": "Expat Health Insurance",
            "url": "https://www.imglobal.com/expat-insurance"
        },
        {
            "position": 3,
            "domain": "www.allianzcare.com",
            "title": "Expat Health Insurance for Professionals",
            "url": "https://www.allianzcare.com/en/personal-international-health-insurance/who-we-help/professionals.html"
        },
        {
            "position": 4,
            "domain": "www.reddit.com",
            "title": "Expat Medical/Health Insurance",
            "url": "https://www.reddit.com/r/expats/comments/1guescz/expat_medicalhealth_insurance/"
        },
        {
            "position": 6,
            "domain": "www.axaglobalhealthcare.com",
            "title": "Expat health insurance",
            "url": "https://www.axaglobalhealthcare.com/en/expat-health-insurance/"
        },
        {
            "position": 7,
            "domain": "www.greenbacktaxservices.com",
            "title": "Do I Need Health Insurance Living Abroad? Expat Guide",
            "url": "https://www.greenbacktaxservices.com/blog/expat-health-insurance/"
        },
        {
            "position": 8,
            "domain": "www.cignaglobal.com",
            "title": "Global Expat Health Insurance Explained",
            "url": "https://www.cignaglobal.com/resources/expat-health-insurance-explained"
        },
        {
            "position": 9,
            "domain": "aaro.org",
            "title": "AARO Health Insurance Plan for Expat Americans",
            "url": "https://aaro.org/health-insurance/health-insurance-plan"
        },
        {
            "position": 10,
            "domain": "www.internationalinsurance.com",
            "title": "International Health Insurance Coverage for Living Abroad",
            "url": "https://www.internationalinsurance.com/health/?srsltid=AfmBOopw9_rvUvMxfufF1HVYW7po0loXhynJUfwi7z2z_u9kvhjwRUd5"
        },
        {
            "position": 11,
            "domain": "www.international-sante.com",
            "title": "Expatriate health insurance in the United States",
            "url": "https://www.international-sante.com/healthforexpats/expat-insurance/country/united-states/"
        }
    ],
    "domain_counts": {
        "www.imglobal.com": 1,
        "www.allianzcare.com": 1,
        "www.reddit.com": 1,
        "www.axaglobalhealthcare.com": 1,
        "www.greenbacktaxservices.com": 1,
        "www.cignaglobal.com": 1,
        "aaro.org": 1,
        "www.internationalinsurance.com": 1,
        "www.international-sante.com": 1
    },
    "average_position": 6.666666666666667,
    "top_competitors": [
        {
            "position": 2,
            "domain": "www.imglobal.com",
            "title": "Expat Health Insurance",
            "url": "https://www.imglobal.com/expat-insurance"
        },
        {
            "position": 3,
            "domain": "www.allianzcare.com",
            "title": "Expat Health Insurance for Professionals",
            "url": "https://www.allianzcare.com/en/personal-international-health-insurance/who-we-help/professionals.html"
        },
        {
            "position": 4,
            "domain": "www.reddit.com",
            "title": "Expat Medical/Health Insurance",
            "url": "https://www.reddit.com/r/expats/comments/1guescz/expat_medicalhealth_insurance/"
        },
        {
            "position": 6,
            "domain": "www.axaglobalhealthcare.com",
            "title": "Expat health insurance",
            "url": "https://www.axaglobalhealthcare.com/en/expat-health-insurance/"
        },
        {
            "position": 7,
            "domain": "www.greenbacktaxservices.com",
            "title": "Do I Need Health Insurance Living Abroad? Expat Guide",
            "url": "https://www.greenbacktaxservices.com/blog/expat-health-insurance/"
        }
    ]
}