{
    "keyword": "consultant professional liability insurance",
    "country": "US",
    "language": "en",
    "competitors": [
        {
            "position": 2,
            "domain": "www.reddit.com",
            "title": "New independent consultant - Liability Insurance?",
            "url": "https://www.reddit.com/r/consulting/comments/16g70yy/new_independent_consultant_liability_insurance/"
        },
        {
            "position": 3,
            "domain": "www.hiscox.com",
            "title": "Business Consultant Insurance Professional & General ...",
            "url": "https://www.hiscox.com/small-business-insurance/professional-business-insurance/business-consultant-insurance"
        },
        {
            "position": 5,
            "domain": "www.thehartford.com",
            "title": "Professional Liability Insurance for Consultants",
            "url": "https://www.thehartford.com/professional-liability-insurance/consultants"
        },
        {
            "position": 6,
            "domain": "www.nerdwallet.com",
            "title": "Business Consultant Insurance: What You Need, Best ...",
            "url": "https://www.nerdwallet.com/business/insurance/best/consultants"
        },
        {
            "position": 7,
            "domain": "www.risk.cornell.edu",
            "title": "Independent Consultant/Non-Specialist Professional Services ...",
            "url": "https://www.risk.cornell.edu/vendor-provider-main-page/consultant-or-non-specialist/"
        },
        {
            "position": 8,
            "domain": "www.progressivecommercial.com",
            "title": "Consulting Insurance",
            "url": "https://www.progressivecommercial.com/business-insurance/professions/consulting-insurance/"
        },
        {
            "position": 9,
            "domain": "ctlowndes.com",
            "title": "Consultant Liability Insurance: 7 Things to Know",
            "url": "https://ctlowndes.com/blog/business-insurance-for-consultants/"
        },
        {
            "position": 10,
            "domain": "www.nerdwallet.com",
            "title": "Do Consultants Need Professional Liability Insurance?",
            "url": "https://www.nerdwallet.com/business/insurance/learn/do-consultants-need-professional-liability-insurance"
        },
        {
            "position": 11,
            "domain": "www.nextinsurance.com",
            "title": "What's The Best Business Insurance For Consultants?",
            "url": "https://www.nextinsurance.com/blog/best-business-insurance-for-consultants/"
        }
    ],
    "domain_counts": {
        "www.reddit.com": 1,
        "www.hiscox.com": 1,
        "www.thehartford.com": 1,
        "www.nerdwallet.com": 2,
        "www.risk.cornell.edu": 1,
        "www.progressivecommercial.com": 1,
        "ctlowndes.com": 1,
        "www.nextinsurance.com": 1
    },
    "average_position": 6.777777777777778,
    "top_competitors": [
        {
            "position": 2,
            "domain": "www.reddit.com",
            "title": "New independent consultant - Liability Insurance?",
            "url": "https://www.reddit.com/r/consulting/comments/16g70yy/new_independent_consultant_liability_insurance/"
        },
        {
            "position": 3,
            "domain": "www.hiscox.com",
            "title": "Business Consultant Insurance Professional & General ...",
            "url": "https://www.hiscox.com/small-business-insurance/professional-business-insurance/business-consultant-insurance"
        },
        {
            "position": 5,
            "domain": "www.thehartford.com",
            "title": "Professional Liability Insurance for Consultants",
            "url": "https://www.thehartford.com/professional-liability-insurance/consultants"
        },
        {
            "position": 6,
            "domain": "www.nerdwallet.com",
            "title": "Business Consultant Insurance: What You Need, Best ...",
            "url": "https://www.nerdwallet.com/business/insurance/best/consultants"
        },
        {
            "position": 7,
            "domain": "www.risk.cornell.edu",
            "title": "Independent Consultant/Non-Specialist Professional Services ...",
            "url": "https://www.risk.cornell.edu/vendor-provider-main-page/consultant-or-non-specialist/"
        }
    ]
}